{
    "id": 12345,
    "name": "Financial Instrument ABC",
    "createdAt": "2025-10-01T10:00:00Z",
    "details": {
      "category": "equity",
      "status": "active",
      "lastUpdated": "2025-10-14T22:15:00Z",
       "forecastToday": {
         "value": 77.85,
         "direction": "up"
       },
       "additionalMetadataFields": [
         {
           "id": "riskLevel",
           "val": "medium"
         },
         {
           "id": "lastAnalyzed",
           "val": "2025-10-14T20:30:00Z"
         }
       ]
    }
  }